{
  "locks_version": "v1.0",
  "validation_id": "ext-val-s4-20240521",
  "external_source_summary": "The external research document is a summary review of existing literature from sources like Springer, PMC, KFF, and Catalyst, designed to validate findings from a primary research report (referred to as 'the PDF'). The document assesses alignment on key themes in women's health, including symptom dismissal, medical education gaps, fragmented care, cost barriers, the necessity of self-advocacy, the role of peer support, and workplace stigma. It also identifies topics that are more prominent in the external literature (e.g., research underinvestment, racial disparities) and those that appear more original to the primary research (e.g., first-generation clinician struggles, clinician lived experience as an asset).",
  "insight_validations": [
    {
      "insight_id": "INS-001",
      "insight_title": "Medical Training Lacks Mentorship and Burnout Prevention, Disproportionately Affecting First-Generation Doctors",
      "validation_status": "partially_supported",
      "external_evidence_summary": "The external research supports the general themes of clinician burnout and the importance of mentorship for physician well-being and retention. However, it explicitly states that the specific focus on the challenges faced by first-generation doctors is not strongly replicated in the broader literature reviewed and may be a novel finding from the source material.",
      "alignment_notes": "The alignment is strong on the general issues of burnout and mentorship gaps. The 'partial' support comes from the lack of external evidence specifically corroborating the unique struggles of first-generation clinicians, which the external source labels as a more qualitative or original insight.",
      "relevant_external_excerpts": [
        "Clinician burnout, isolation, and mentorship gapsPartially supported.",
        "There is good support for mentorship as important to physician well-being and retention, and broad support for physician burnout as a serious problem.",
        "But the PDF’s more specific framing - especially around first-generation doctors and lack of success models - appears more original to the interview data than something I found strongly replicated in broader women’s-health literature."
      ]
    },
    {
      "insight_id": "INS-002",
      "insight_title": "Lived Experience Enhances Clinical Empathy and Patient Trust",
      "validation_status": "partially_supported",
      "external_evidence_summary": "The external research offers moderate, indirect support. It acknowledges that empathy and therapeutic alliance improve patient outcomes, which aligns with the insight's theme. However, it finds less direct, generalizable evidence for the specific claim that a clinician's own parallel life experiences (like parenting or anxiety) directly improve women's health outcomes.",
      "alignment_notes": "The support is partial because the external evidence is for the general concepts of empathy and therapeutic alliance, not the specific mechanism of a clinician's personal lived experience being a transferable clinical asset. The external source frames this as a 'promising qualitative insight rather than a settled evidence-based conclusion.'",
      "relevant_external_excerpts": [
        "Clinicians’ personal lived experience as a clinical assetModerately supported, but less directly.",
        "There is broader evidence that empathy and therapeutic alliance improve patient experience and outcomes, and psychotherapy literature supports intentional use of the therapist’s self.",
        "But I found less direct external evidence for the specific claim that a clinician’s own parenting, anxiety, or parallel life experience improves women’s-health outcomes in a generalizable way."
      ]
    },
    {
      "insight_id": "INS-003",
      "insight_title": "Community and Shared Experience Are Powerful Antidotes to Widespread Loneliness",
      "validation_status": "supported",
      "external_evidence_summary": "The external research strongly supports this insight. It consistently finds that peer and social support are linked to validation, coping, belonging, and improved emotional outcomes, particularly in contexts like postpartum care and cancer survivorship. The document affirms that community and shared stories serve as a counterweight to isolation.",
      "alignment_notes": "The alignment is very strong. The external evidence directly corroborates the role of community as a protective factor against isolation.",
      "relevant_external_excerpts": [
        "Peer community and storytelling as protective factorsStrongly supported.",
        "Postpartum and cancer-survivorship literature consistently links social support and peer support with validation, coping, belonging, and better emotional outcomes.",
        "The PDF’s framing of community and shared stories as a counterweight to isolation aligns well with this body of evidence."
      ]
    },
    {
      "insight_id": "INS-004",
      "insight_title": "Clinicians Actively Destigmatize Mental Health by Normalizing Emotional Experiences",
      "validation_status": "not_addressed",
      "external_evidence_summary": "The external research document does not specifically address the clinical practice of destigmatizing mental health by normalizing emotional experiences or using specific language choices (e.g., 'sadness' vs. 'depression'). While it acknowledges workplace stigma around mental health, it does not evaluate this particular clinician-led behavioral pattern.",
      "alignment_notes": "There is no content in the external document that either supports or contradicts this insight. The topic is not covered.",
      "relevant_external_excerpts": []
    },
    {
      "insight_id": "INS-005",
      "insight_title": "Patients Must Act as Self-Advocates in Healthcare Settings",
      "validation_status": "supported",
      "external_evidence_summary": "The external research supports the insight that patients are often forced into self-advocacy and self-education. The literature connects provider dismissal and diagnostic delays directly with the necessity for women to persist, navigate the system themselves, and compensate for systemic blind spots.",
      "alignment_notes": "The alignment is strong. The external document confirms the behavior of self-advocacy as a response to system failures. It also notes that the source material (the 'PDF') better captures the emotional burden and labor involved, which is a nuance.",
      "relevant_external_excerpts": [
        "Patients are pushed into self-advocacy, self-education, and “doing their own research”Supported.",
        "The external literature repeatedly links dismissal and diagnostic delay with the need for women to persist, self-advocate, and navigate systems themselves.",
        "Research confirms behavior, but your report better captures emotional burden + labor"
      ]
    },
    {
      "insight_id": "INS-006",
      "insight_title": "Identity Crisis Arises When Professional Roles Overshadow Personal Self",
      "validation_status": "not_addressed",
      "external_evidence_summary": "The external research document does not address the topic of identity crisis resulting from an over-identification with a professional role. The provided text focuses on systemic healthcare issues and does not delve into this specific emotional or psychological pattern.",
      "alignment_notes": "There is no relevant content in the external document to validate this insight.",
      "relevant_external_excerpts": []
    },
    {
      "insight_id": "INS-007",
      "insight_title": "Social Stigma and Isolation Create Significant Barriers to Connection and Mental Wellness",
      "validation_status": "supported",
      "external_evidence_summary": "The external research strongly supports the idea that stigma creates barriers to wellness. It specifically validates the existence of workplace silence and stigma around women's health issues like menopause, fertility, and mental health. The document also corroborates the concept of isolation as a key problem that peer support and community can counteract.",
      "alignment_notes": "The alignment is strong. The external document confirms that stigma around women's health issues is a significant barrier in various settings, which directly supports the premise of this insight.",
      "relevant_external_excerpts": [
        "Workplace silence and stigma around menopause, fertility, and mental healthStrongly supported.",
        "Catalyst found that 84% of respondents wanted more menopause support at work, and some had declined job opportunities because of the lack of it.",
        "The PDF’s framing of community and shared stories as a counterweight to isolation aligns well with this body of evidence."
      ]
    },
    {
      "insight_id": "INS-008",
      "insight_title": "Transforming Personal Hardship into Peer Support Creates Purpose and Community",
      "validation_status": "supported",
      "external_evidence_summary": "The external research strongly supports the core components of this insight. It consistently identifies peer support and storytelling as protective factors that provide validation, improve coping, and foster better emotional outcomes, particularly in cancer survivorship and postpartum contexts. This aligns with the idea of transforming personal hardship into a resource for others.",
      "alignment_notes": "The alignment is very strong. The external evidence directly validates the power of peer community and shared stories, which is the mechanism described in the insight for transforming hardship into support.",
      "relevant_external_excerpts": [
        "Peer community and storytelling as protective factorsStrongly supported.",